protectionId,tag,description
1,APPLY_SUNSCREEN,Apply broad-spectrum sunscreen (SPF 30 or higher) to all exposed skin at least 20 minutes before going outside. Reapply every 2 hours or after swimming or sweating.
2,WEAR_PROTECTIVE_CLOTHING,"Wear protective clothing such as long sleeve shirts, long pants, and UV-protective fabrics (UPF 30+ or higher) to reduce skin exposure to harmful ultraviolet radiation."
3,WEAR_HAT,"Wear a wide-brim or legionnaire hat to protect the face, ears, and neck from direct sunlight."
4,WEAR_SUNGLASSES,Use UV-protective sunglasses to shield your eyes and the sensitive skin around them from harmful UV radiation.
5,SEEK_SHADE,"Seek shade whenever possible, especially during peak UV hours between 10 AM and 4 PM."
6,LIMIT_EXPOSURE,"Limit the amount of time spent in direct sunlight, particularly when the UV index is high or extreme."
7,CHECK_UV_INDEX,Check the daily UV index before going outdoors and adjust your sun protection measures accordingly.
8,STAY_INDOORS,"During extreme UV conditions, minimize outdoor activities and stay indoors whenever possible."
